{
  "time_basis": "local_instant",
  "timezone": "America/Denver",
  "timezone_database_version": "2026a",
  "rules": [
    {
      "frequency": "DAILY",
      "interval": "3",
      "seed": "2026-08-03T08:00:00",
      "start_bound": "2026-08-03T08:00:00",
      "end_condition": { "kind": "unbounded" }
    }
  ]
}
